show,season,episode,title,us_viewers,air_date,imdb_rating,total_votes,description
The Office,6,17,The Delivery: Part 1,9000000,3/4/10,8.4,3438,"Pam goes into labor and Jim is ready to take her to the hospital, but she refuses to go. Meanwhile, inspired by Pam and Jim's baby, Dwight and Angela try to reach a ""business agreement"" to have a baby of their own."
The Office,6,18,The Delivery: Part 2,9000000,3/4/10,8.5,3445,"After the baby is born, Pam has trouble getting the baby to breastfeed. At the office, Michael takes credit for hooking Jim and Pam up, and tries to do the same thing for Kevin and Erin, making Andy jealous."
The Office,6,19,St. Patrick's Day,7510000,3/11/10,7.6,3180,"It's St. Patrick's Day, and the CEO forces the office to work late because she won't leave. In addition, Michael unsuccessfully tries to suck up to his new boss, and Andy and Erin's first date is delayed because Erin is sick."
The Office,6,20,New Leads,7630000,3/18/10,7.7,3158,"When the sales staff begins trying to boss around everyone in the office, Michael tries to teach them a lesson by withholding a valuable set of sales leads."
The Office,6,21,Happy Hour,7170000,3/25/10,8.6,3613,"Oscar gets everybody in the office to go to Happy Hour so that he can hit on a coworker in shipping. Pam tries to set up Michael with a friend at the bar, but Michael's alter ego, ""Date Mike,"" threatens to spoil the entire evening."
The Office,6,22,Secretary's Day,6300000,4/22/10,7.8,3159,"Michael creates problems for Andy on Secretary's Day when he tells Erin that Andy was engaged to Angela, and Kevin is upset after Oscar makes a video comparing Kevin to Cookie Monster."
The Office,6,23,Body Language,7010000,4/29/10,7.9,3175,"Michael is hopeful that a potential client is interested in him, but everyone in the office except Pam thinks he's wasting his time. Meanwhile, Dwight recruits Kelly to apply for the Sabre minority management training program."
The Office,6,24,The Cover-Up,6840000,5/6/10,8.1,3168,"Michael becomes convinced that Donna is having an affair and puts Dwight on the case, but Pam soon discovers that the suspicions may be true. Meanwhile, Darryl gets revenge on Andy for an earlier incident."
The Office,6,25,The Chump,6600000,5/13/10,7.7,3064,"Michael continues to see Donna even after learning she's married and meeting her husband, Dwight and Angela take their baby contract to an arbitrator, and Jim and Pam struggle to stay awake at the office."
The Office,6,26,Whistleblower,6600000,5/20/10,8,3161,"Jo comes to the Scranton branch to find the whistle-blower. However, three different people have confessed to Michael, Michael is protecting them, and the person most people think is the culprit is keeping his mouth shut."
The Office,7,1,Nepotism,8400000,9/23/10,8.3,3627,"Everybody demands that Michael fire the new office assistant, but he won't because he's his nephew. Meanwhile, Pam tries to play a prank on Dwight, who has bought the office building, to make up for ruining Jim's prank."
The Office,7,2,Counseling,7360000,9/30/10,8.2,3288,"Michael is forced to go through counseling with Toby, Dwight seeks revenge on a local mall that refused his business, and Pam tries to fake her way to a promotion."
The Office,7,3,Andy's Play,6950000,10/7/10,8.2,3512,"Andy invites the entire office to watch him in the community theater production of ""Sweeney Todd,"" but Erin decides to babysit for Jim and Pam instead, and Michael is upset because he auditioned for the lead and didn't get it."
The Office,7,4,Sex Ed,7360000,10/14/10,7.8,3233,"A herpes scare causes Michael to get back in touch with his ex-girlfriends, where he decides to reevaluate those relationships. Meanwhile, Andy tries to teach safe sex to his officemates, but he has a clear ulterior motive."
The Office,7,5,The Sting,6870000,10/21/10,7.7,3149,"Michael organizes a sting operation to find out the secrets of a rival paper company's salesman who is stealing Dunder Mifflin's clients, and Andy gets Darryl's help to form a band."
The Office,7,6,Costume Contest,8070000,10/28/10,8.2,3278,"It's Halloween at Dunder Mifflin, and Michael is upset that Darryl went over his head with an idea, and Jim and Pam are obsessed with finding out why Danny didn't call Pam back when they were dating four years ago."
The Office,7,7,Christening,7650000,11/4/10,7.4,3267,"During Jim and Pam's daughter's christening, Michael becomes upset over the lack of family-like unity between himself and his employees. So he responds by impulsively joining a teenage church mission to Mexico."
The Office,7,8,Viewing Party,7150000,11/11/10,7.8,3216,"Michael sabotages Erin's ""Glee"" viewing party because of his contempt for Gabe, Jim and Pam discover that Dwight can keep their daughter from crying, and Andy has a bad reaction to a mixture of wine and a Japanese stimulant."
The Office,7,9,WUPHF.com,7280000,11/18/10,7.7,3115,"Some co-workers who invested in Ryan's Internet venture want him to sell, but Michael refuses to go along. Meanwhile, Jim loses his motivation to work when he reaches his commission cap, and Dwight creates a hay festival in the parking lot."
The Office,7,10,China,7310000,12/2/10,8.2,3299,"Pam stands up to Dwight when he makes cutbacks to save money in the building, but will Dwight have the last laugh? Meanwhile, the office is surprised and energized when Michael outsmarts Oscar in a debate about China."
The Office,7,11,Classy Christmas,7180000,12/9/10,9,4190,"Michael throws an elaborate Christmas party to celebrate Holly's temporary return to the Scranton branch, but is disappointed when he learns that she still has a boyfriend."
The Office,7,12,Ultimatum,8260000,1/20/11,8.3,3332,"Michael gets upset when Holly returns from the holidays without an engagement ring, but still together with her boyfriend. Meanwhile, Pam tries to help her co-workers keep with their New Year's resolutions."
The Office,7,13,The Seminar,7930000,1/27/11,7.6,3167,"Andy tries to host a small business seminar at the office. Michael agrees to help by posing as a Greek entrepreneur, and tries to get Holly to play along."
The Office,7,14,The Search,7290000,2/3/11,8.5,3505,"When Jim gets an emergency phone call from Helene, he is forced to leave Michael in the bathroom of a gas station. Meanwhile, Holly, Erin, and Dwight set out on a journey to find Michael. Back at the office, Pam's artwork starts a captioning contest that seems to offend Gabe."
The Office,7,15,PDA,6900000,2/10/11,8.4,3413,"It's Valentine's Day, and the office is fed up with Michael and Holly's PDA, Andy helps Erin solve Gabe's riddles to find her gift, and Jim and Pam get drunk and try to find a place in the office to have sex."
The Office,7,16,Threat Level Midnight,6410000,2/17/11,9.4,7272,"Michael finally finishes his movie ""Threat Level Midnight"" and screens it for his employees at Dunder Mifflin, but Holly is less than enthusiastic for his finished product."
The Office,7,17,Todd Packer,6120000,2/24/11,7.4,3117,"Everyone is up in arms after Michael convinces Holly to give Todd Packer an office job, and Andy gets upset after Pam gets a new computer for reception but not for him."
The Office,7,18,Garage Sale,7070000,3/24/11,9.4,5573,"Michael plans to propose to Holly the day of the Dunder Mifflin garage sale, but Holly may have to take an extended leave of absence to Colorado because her father is sick."
The Office,7,19,Training Day,7870000,4/14/11,7.7,3232,"Michael makes fast friends with the man coming in to replace him at Dunder Mifflin, but later begins to have second thoughts after seeing him in action."
The Office,7,20,Michael's Last Dundies,6850000,4/21/11,9,4576,"Michael hosts his final ""Dundies"" as the boss at the Scranton branch, but tension is in the air, and Deangelo Vickers, the new boss, is having trouble with his co-hosting duties."
The Office,7,21,"Goodbye, Michael",8420000,4/28/11,9.8,12236,"As the office gets ready for Michael's final day at Dunder Mifflin, Michael doesn't tell anyone that he's leaving a day early. Meanwhile, Deangelo accompanies a nervous Andy on a visit to one of Michael's old clients."
The Office,7,22,The Inner Circle,6900000,5/5/11,7.5,3214,"Tensions rise and feelings are hurt when Deangelo creates an ""inner circle"" at the office--which is only composed of men."
The Office,7,23,"Dwight K. Schrute, (Acting) Manager",6450000,5/12/11,8.7,3528,"When Jim rejects Jo's offer, Dwight becomes acting manager at the Scranton branch, but an accident could cause his tenure to be short-lived."
The Office,7,24,Search Committee,7290000,5/19/11,8.7,3719,"The Scranton branch puts together a search committee to find the next boss, but the pool of interviewees proves to be less than impressive, and Dwight demands an interview in spite of his gun accident."
The Office,8,1,The List,7640000,9/22/11,8.1,3377,"New Dunder Mifflin CEO Robert California leaves a piece of paper with a line down the middle that has names of the Scranton staff on either side of it, leading everyone to try and figure out what it means."
The Office,8,2,The Incentive,6700000,9/29/11,8.1,3202,"Under pressure from Robert to increase branch sales, Andy offers an incentive program to the sales staff, which backfires on him when he offers a very personal grand prize."
The Office,8,3,Lotto,5820000,10/6/11,7.2,3050,"After the entire warehouse staff wins the lottery and quits their job, Darryl becomes depressed and demands to be fired. Meanwhile, the office staff is forced to load the truck for their orders themselves."
The Office,8,4,Garden Party,6080000,10/13/11,8.1,3348,"Andy claims to be throwing a garden party at Dwight's farm to impress Robert California, but he's really doing it to win the approval of his parents, who appear to favor his younger brother."
The Office,8,5,Spooked,5530000,10/27/11,7.5,2992,"Erin is worried that she is about to get fired after she organizes a disastrous office Halloween party for Robert and his son. Meanwhile, Robert probes the minds of the employees to come up with the perfect spooky story."
The Office,8,6,Doomsday,6150000,11/3/11,7.6,2882,"Dwight installs a ""Doomsday Device"" on the office computers that could get everyone fired if they make too many mistakes, while Gabe tries to hit on one of Darryl's warehouse employees."
The Office,8,7,Pam's Replacement,5960000,11/10/11,7.7,3079,"A pregnant and insecure Pam tries to prove that Jim is attracted to her temp replacement, and Robert and his musician friends take over a jam session with Andy, Kevin, and Darryl."
The Office,8,8,Gettysburg,5500000,11/17/11,6.8,3102,Andy decides to motivate and inspire everyone by taking them on a field trip to Gettysburg. Some people in the office stay behind and Robert California asks them to come up with Dunder Mifflin/Sabre's next big idea.
The Office,8,9,Mrs. California,5710000,12/1/11,7.6,3020,"Robert brings his wife to the office so that she can find a job, but he gives Andy conflicting messages about whether to hire her. Meanwhile, Dwight opens a gym in the building and tries to persuade Darryl to join."
The Office,8,10,Christmas Wishes,5790000,12/8/11,7.9,2950,"Andy tries to make this year's Christmas the best ever by granting each person's holiday wishes. Meanwhile, Robert California tries to drown his sorrows at the office party."
The Office,8,11,Trivia,5900000,1/12/12,7.9,2916,"Andy hopes to make up for a sales deficiency by entering and winning a bar trivia competition, while Dwight flies to corporate headquarters in Florida to demand a management interview with Robert."
The Office,8,12,Pool Party,6020000,1/19/12,8,3162,"Robert throws a party for the Dunder Mifflin staff at his house before he sells it because of his divorce. At the party, Erin and Dwight agree to flirt with each other to make Andy jealous, and Jim tries in vain to duck out early."
The Office,8,13,Jury Duty,5310000,2/2/12,7.4,2860,"Jim gets caught in a lie about his week of ""jury duty,"" and new questions emerge when Angela gives birth to a ""premature"" baby."
The Office,8,14,Special Project,5190000,2/9/12,7.6,2784,"Andy puts Dwight in charge of a special project in Tallahassee, but Dwight doesn't like the team Andy's assembled for him. Meanwhile, Darryl tries to figure out the meaning of Val's Valentine's gift."
The Office,8,15,Tallahassee,4380000,2/16/12,7.8,2936,"Dwight refuses to let appendicitis get in the way of leading his new team in Tallahassee, while Andy decides to step in for Erin as secretary in the office."
The Office,8,16,After Hours,5020000,2/23/12,8.1,3045,"In Tallahassee, Dwight and Todd Packer try to romance Nellie to get the VP position, while Jim wonders if a colleague is trying to hit on him. Back in Scranton, Val's boyfriend shows up with a message for Darryl."
The Office,8,17,Test the Store,4950000,3/1/12,7.8,2899,"Dwight and his team get ready for the grand opening of the Sabre Store, while Andy makes Toby teach self-defense to the Scranton branch employees after he is beat up in the parking lot by a girl."
The Office,8,18,Last Day in Florida,4890000,3/8/12,7.8,2829,"Jim tries to warn Dwight that he's going to be fired after Robert rejects the Sabre Store idea, but he refuses to listen. Meanwhile, Darryl and Toby try to sell cookies to Kevin, and Erin tells Andy she's not coming back from Florida."
The Office,8,19,Get the Girl,4870000,3/15/12,6.4,3320,"Andy goes to Tallahassee to tell Erin that he loves her and needs her to return to Scranton. Meanwhile, Nellie shows up in Scranton and tries to claim Andy's manager position by offering everyone raises."
The Office,8,20,Welcome Party,4390000,4/12/12,7,2919,"Andy tries to break up with his girlfriend after going to Florida to declare his love for Erin, and the office employees are forced against their will to throw a party for the hated Nellie."
The Office,8,21,Angry Andy,4350000,4/19/12,6.8,3170,"Andy and Erin return to Dunder Mifflin, only to discover that Nellie has taken his job and office and refuses to give them up. Meanwhile, Ryan becomes jealous after Pam tries to play matchmaker for Kelly."
The Office,8,22,Fundraiser,4170000,4/26/12,7,2809,Andy confronts Robert for the first time after losing the manager position and quitting his job at a fund raiser sponsored by Angela's husband.
The Office,8,23,Turf War,4440000,5/3/12,7.6,2724,"Dwight and Jim fight with the Syracuse over a client after Robert shuts down the Binghamton branch, and Andy sees an opportunity for revenge. Meanwhile Robert tries to figure out the contents of a drunken voicemail to Nellie."
The Office,8,24,Free Family Portrait Studio,4490000,5/10/12,7.7,2842,"With former CEO David Wallace's help, Andy launches a plan to get revenge on the Scranton branch. Meanwhile, Dwight launches his own plan to find out if he's the father of Angela's baby."
The Office,9,1,New Guys,4280000,9/20/12,7.5,3054,"Dwight and Jim are intimidated by the office's newest additions, who are considered younger versions of themselves. Meanwhile, Andy tries to make Nellie's life miserable, and Angela tries to get rid of one of her cats."
The Office,9,2,Roy's Wedding,4130000,9/27/12,7.1,2917,"After Roy's wedding, Jim and Pam wonder if they still have any secrets they're hiding from each other. Meanwhile, Clark tricks Erin into a ""news audition,"" and Dwight challenges Nellie's new charity initiative."
The Office,9,3,Andy's Ancestry,4140000,10/4/12,7.3,2873,"Nellie plays a trick on Andy after researching his ancestry, Dwight teaches Erin a new language, and Pam tries to teach Nellie how to drive."
The Office,9,4,Work Bus,4280000,10/18/12,7.8,3063,"When Jim convinces Dwight that the building is unsafe, Dwight rents a bus and sets up the office inside. Nellie asks for Andy's help in adopting a baby. Meanwhile, Jim tries to make Pam happy with some pie."
The Office,9,5,Here Comes Treble,4000000,10/25/12,6.9,2968,"On Halloween, the Cornell a Capella group pays a visit to Andy, Dwight discovers that Nellie takes anxiety pills, and Pam disapproves of Jim's business decision."
The Office,9,6,The Boat,4830000,11/8/12,7.7,2908,"Andy has one last chance to captain the family boat before he sells it, Jim, Pam, and Nellie prank Dwight with a radio interview, and Kevin finds out about Oscar's affair with Angela's husband."
The Office,9,7,The Whale,4160000,11/15/12,7.6,2782,"The office trains Dwight to sell to a female client without being offensive, only to discover that the client is Jan Levinson. Angela and Oscar both think the senator is cheating on them, and Jim has trouble on an important conference call."
The Office,9,8,The Target,3880000,11/29/12,7.8,2911,"Angela orders a hit on Oscar for cheating with her husband, the office makes a tower with their customer complaint cards, Jim wines and dines Stanley and Phyllis in exchange for a favor, and Pam begins her mural."
The Office,9,9,Dwight Christmas,4160000,12/6/12,8.4,3280,"Dwight puts together a Pennsylvania Dutch-themed office Christmas party, but he ends it abruptly because Jim has to leave for his other job. Meanwhile, Erin seeks comfort from a co-worker after a disappointing text from Andy."
The Office,9,10,Lice,4540000,1/10/13,7.6,2880,"Pam causes a lice outbreak but lets Meredith take the blame, Jim has a business meeting with Dr. J, and some coworkers try to get Darryl and Val back together."
The Office,9,11,Suit Warehouse,4150000,1/17/13,7.8,2827,"Dwight and Clark pose as father and son to get an account, Darryl goes for an interview with Jim's new business, and everybody in the office goes crazy over a new espresso machine."
The Office,9,12,Customer Loyalty,4190000,1/24/13,7.9,2918,"Dwight tries to keep Darryl from leaving Dunder Mifflin, Jim misses his daughter's recital because of an important business meeting, and Nellie is worried that Erin will dump Andy for Pete."
The Office,9,13,Junior Salesman,4450000,1/31/13,7.5,2765,Dwight gets to hire a new salesman to replace Jim when he is at his other job. But will he promote Clark or go with one of his unqualified friends instead?
The Office,9,14,Vandalism,3970000,1/31/13,7.4,2774,"Pam tries to find out who vandalized her mural, Darryl finds out that Jim is a slob, and Oscar and Kevin go to Angela and The Senator's child's first birthday party."
The Office,9,15,Couples Discount,4150000,2/7/13,7.2,2828,"Andy returns after three months to an angry office and an even angrier girlfriend, and Jim's Valentines Day with Pam does not go as planned."
The Office,9,16,Moving On,4060000,2/14/13,8,3065,"Andy finds out that Erin dumped him for Pete, Dwight gets Angela's help taking care of his aunt, and Pam interviews with a real estate firm whose boss is a carbon-copy of Michael Scott."
The Office,9,17,The Farm,3540000,3/14/13,7.5,3231,Show follows Dwight Schrute a beet farmer running a bed and breakfast inn.
The Office,9,18,Promos,3440000,4/4/13,8,2857,"The release of the documentary promos creates tension for the Dunder Mifflin employees, Dwight considers a business venture with his girlfriend's family, and Jim and Darryl have an awkward business meeting with baseball player Ryan Howard."
The Office,9,19,Stairmageddon,3830000,4/11/13,8,2961,"Dwight shoots Stanley with a bull tranquilizer after he refuses to go on a sales call, Jim and Pam head to marriage counseling, The Senator comes out of the closet, and Andy tries to find a talent agent."
The Office,9,20,Paper Airplane,3250000,4/25/13,8,3040,"The employees hold a paper airplane competition, Andy gets an acting role in a workplace safety video, and Jim and Pam's marriage tensions continue to build."
The Office,9,21,Livin' the Dream,3510000,5/2/13,9.1,4448,"Dwight becomes regional manager after Andy quits his job, Jim dedicates more time to his Dunder Mifflin job to save his marriage, and Angela has problems with her new living arrangements after her breakup with The Senator."
The Office,9,22,A.A.R.M.,4560000,5/9/13,9.5,5930,"Dwight prepares for a marriage proposal and hires an assistant for his assistant, Andy auditions for a singing program, Darryl tries to leave his job without a fuss, and Pam has second thoughts about Jim staying in Scranton."
The Office,9,23,Finale,5690000,5/16/13,9.8,15245,"One year later, Dunder Mifflin employees past and present reunite for a panel discussion about the documentary and to attend Dwight and Angela's wedding."
Friends,1,1,The One Where Monica Gets a Roommate: The Pilot,21500000,9/22/94,8.3,8378,"Monica and the gang introduce Rachel to the ""real world"" after she leaves her fiancé at the altar."
Friends,1,2,The One with the Sonogram at the End,20200000,9/29/94,8,6441,Ross finds out his ex-wife is pregnant. Rachel returns her engagement ring to Barry. Monica becomes stressed when her and Ross's parents come to visit.
Friends,1,3,The One with the Thumb,19500000,10/6/94,8.1,6060,Monica becomes irritated when everyone likes her new boyfriend more than she does. Chandler resumes his smoking habit. Phoebe is given $7000 when she finds a thumb in a can of soda.
Friends,1,4,The One with George Stephanopoulos,19700000,10/13/94,8.1,5892,"Joey and Chandler take Ross to a hockey game to take his mind off the anniversary of the first time he slept with Carol, while the girls become depressed when they realize they don't have a 'plan'."
Friends,1,5,The One with the East German Laundry Detergent,18600000,10/20/94,8.4,5872,"Eager to spend time with Rachel, Ross pretends his washroom is rat-infested so he can join her at the laundromat. Meanwhile, Joey has Monica pose as his girlfriend, and Chandler struggles to break up with his girlfriend."
Friends,1,6,The One with the Butt,18200000,10/27/94,8.1,5609,Monica's obsessiveness is put to the test after Rachel cleans the apartment. Joey lands a film role as Al Pacino's butt double. Chandler enjoys a relationship with all of the fun but none of the responsibility.
Friends,1,7,The One with the Blackout,23500000,11/3/94,9,7133,"When New York suffers from a blackout, Ross tries to tell Rachel that he likes her, and Chandler gets stuck in an ATM vestibule with a model."
Friends,1,8,The One Where Nana Dies Twice,21100000,11/10/94,8.1,5488,Monica and Ross mourn the loss of their grandmother. Chandler is shocked to find that people think he is gay.
Friends,1,9,The One Where Underdog Gets Away,23100000,11/17/94,8.2,5316,The gang's plans for Thanksgiving go awry after they get locked out of Monica and Rachel's apartment.
Friends,1,10,The One with the Monkey,19900000,12/15/94,8,5337,The gang make (and break) a pact not to bring dates to their New Years Eve party. Phoebe starts dating a scientist. Ross compensates for his loneliness by getting a monkey.
Friends,1,11,The One with Mrs. Bing,26600000,1/5/95,8.2,5265,"Chandler's flamboyant romance-novelist mother comes to visit, and Joey catches her kissing Ross. Meanwhile, Monica and Phoebe fight over a guy in a coma."
Friends,1,12,The One with the Dozen Lasagnas,24000000,1/12/95,8.2,5161,Rachel and Paolo's relationship hits a snag when he makes a pss at Phoebe. Ross refuses to find out the sex of his baby until it's born. Chandler and Joey go shopping for a new kitchen table.
Friends,1,13,The One with the Boobies,25800000,1/19/95,8.6,5508,Joey finds out his dad has a mistress. Rachel tries to even the score after Chandler inadvertently catches a glimpse of her breasts. Phoebe dates a shrink who analyzes the gang.
Friends,1,14,The One with the Candy Hearts,23800000,2/9/95,8.2,5082,"As Valentine's Day approaches; Ross and his date end up at the same restaurant as Carol and Susan, Joey inadvertently sets Chandler up on a blind date with Janice, and the girls burn mementos of their old boyfriends."
Friends,1,15,The One with the Stoned Guy,24800000,2/16/95,8.2,5124,"Monica cooks a gourmet meal for a restaurateur who is looking for a new chef, however he arrives at the apartment stoned. Meanwhile, Ross tries to master 'dirty talk'."
Friends,1,16,The One with Two Parts: Part 1,26100000,2/23/95,8.1,5046,Phoebe feels neglected when Joey falls for her twin sister. Chandler struggles to fire an attractive co-worker. Ross attends Lamaze classes with Carol and Susan.
Friends,1,17,The One with Two Parts: Part 2,30500000,2/23/95,8.4,5142,"Rachel switches identities with Monica so she can use her health insurance. Meanwhile, Ursula continues to come between Phoebe and Joey."
Friends,1,18,The One with All the Poker,30400000,3/2/95,8.8,5690,"As Rachel interviews for a new job, the girls take on the guys in a game of poker."
Friends,1,19,The One Where the Monkey Gets Away,29400000,3/9/95,8.1,4923,The gang frantically search for Ross's monkey Marcel after Rachel loses him.
Friends,1,20,The One with the Evil Orthodontist,30000000,4/6/95,7.8,4916,"Rachel and Barry start dating again, despite the fact that he's now engaged to Mindy; Chandler goes nuts when a woman he likes won't return his phone calls."
Friends,1,21,The One with the Fake Monica,28400000,4/27/95,7.8,4954,Monica befriends the woman who stole her credit card. Ross is forced to give away Marcel. Joey tries to come up with a less ethnic-sounding stage name.
Friends,1,22,The One with the Ick Factor,29900000,5/4/95,8.3,4916,Monica gets a shock when she finds out her boyfriend is a high school student. Chandler finds out his colleagues don't like him when Phoebe temps as his secretary.
Friends,1,23,The One with the Birth,28700000,5/11/95,8.7,5191,"As Carol goes into labor; Ross and Susan argue, Rachel flirts with Carol's doctor, and Joey assists a pregnant single mother."
Friends,1,24,The One Where Rachel Finds Out,31300000,5/18/95,8.9,5532,"As Ross leaves for China, Chandler accidentally reveals Ross's feelings for Rachel. Joey takes part in a fertility study and is unable to sleep with his new girlfriend."
Friends,2,1,The One with Ross's New Girlfriend,32100000,9/21/95,8.5,5036,"Rachel waits for Ross at the airport, unaware he has a new girlfriend. Meanwhile, Chandler has a frightening experience with Joey's tailor, and Phoebe gives Monica a bad haircut."
