show,season,episode,title,us_viewers,air_date,imdb_rating,total_votes,description
The Office,1,1,Pilot,11200000,3/24/05,7.4,7006,"The premiere episode introduces the boss and staff of the Dunder-Mifflin Paper Company in Scranton, Pennsylvania in a documentary about the workplace."
The Office,1,2,Diversity Day,6000000,3/29/05,8.3,6902,"Michael's off color remark puts a sensitivity trainer in the office for a presentation, which prompts Michael to create his own."
The Office,1,3,Health Care,5800000,4/5/05,7.7,5756,"Michael leaves Dwight in charge of picking the new healthcare plan for the staff, with disastrous results ahead."
The Office,1,4,The Alliance,5400000,4/12/05,8,5579,"Just for a laugh, Jim agrees to an alliance with Dwight regarding the downsizing rumors."
The Office,1,5,Basketball,5000000,4/19/05,8.4,6183,Michael and his staff challenge the warehouse workers to a basketball game with a bet looming over both parties.
The Office,1,6,Hot Girl,4800000,4/26/05,7.7,5495,Michael is just one of the many male staff who start vying for the attention of an attractive saleswoman in the office.
The Office,2,1,The Dundies,9000000,9/20/05,8.7,6184,"Very much unlike his staff, an overeager Michael can't wait for this year's annual Dundies awards."
The Office,2,2,Sexual Harassment,7130000,9/27/05,8.2,5299,The office reviews its sexual harassment policy in light of explicit e-mails.
The Office,2,3,Office Olympics,8300000,10/4/05,8.3,5249,"Ready to finalize his deal for a new condo, Michael is away with Dwight while Jim rallies the staff together for office games."
The Office,2,4,The Fire,7600000,10/11/05,8.3,5183,A fire in the kitchen relegates the staff to the parking lot as help is on its way.
The Office,2,5,Halloween,8000000,10/18/05,8.1,4857,"Michael is pressured by corporate to fire someone, which puts a damper on the office Halloween party."
The Office,2,6,The Fight,7900000,11/1/05,8.1,4867,Jim rallies the staff together to witness a showdown between Michael and Dwight at Dwight's martial arts school.
The Office,2,7,The Client,7500000,11/8/05,8.6,5125,"With Michael and Jan Levinson-Gould away from the office to land a new client, the staff discovers an unproduced screenplay in Michael's office."
The Office,2,8,Performance Review,8000000,11/15/05,8.1,4629,"Instead of talking to his employees about their work, Michael uses their annual review time to gather feedback on his ""relationship"" with Jan."
The Office,2,9,E-Mail Surveillance,8100000,11/22/05,8.4,4766,"Michael decides to set up e-mail surveillance for all company e-mail, and discovers that Jim has invited everyone over for a barbeque except him."
The Office,2,10,Christmas Party,9700000,12/6/05,8.9,5278,"Seeing the party is headed for disastrous boredom, Michael breaks corporate policy to buy alcohol for the staff."
The Office,2,11,Booze Cruise,8700000,1/5/06,8.6,5086,"The Dunder Mifflin staff go on a mandatory ""booze cruise"" to hear Michael give a motivational talk."
The Office,2,12,The Injury,10300000,1/12/06,9.1,6120,"Michael's ""injury"" from a George Foreman Grill distracts the staff from Dwight, the one with the real injury."
The Office,2,13,The Secret,8700000,1/19/06,8.2,4518,"Jim fears the secret he told to Michael, in confidence, will be revealed to the staff."
The Office,2,14,The Carpet,8600000,1/26/06,7.8,4465,Michael's office becomes the victim of an odorous prank which subjects the office to his punishment.
The Office,2,15,Boys and Girls,5420000,2/2/06,8.1,4431,"Jan comes into the Scranton Branch to give all the female employees a group seminar on women in the workplace. Upset that he is not allowed in on the proceedings, Michael takes all the men of Dunder Mifflin down into the warehouse for some ""guy time"" with the warehouse workers. Pam is offered a chance to pursue her dreams of drawing and Roy confronts Jim about his feelings for Pam."
The Office,2,16,Valentine's Day,8950000,2/9/06,8.3,4450,"When Michael visits Dunder Mifflin corporate headquarters in New York on Valentine's Day, he and Jan are both in for a surprise. Meanwhile, back in Scranton, the office staff celebrates Valentine's Day grade school style."
The Office,2,17,Dwight's Speech,8400000,3/2/06,8.4,4737,Michael coaches pompous Dwight on the finer art of public speaking after being named as Salesman of the Year.
The Office,2,18,Take Your Daughter to Work Day,8800000,3/16/06,8.3,4590,"A routine office day is changed when children come to Dunder Mifflin for ""Take Your Daughter to Work Day."" Michael is surprised when he strikes up a friendship with the five-year old daughter of his sworn enemy, Toby. Pam is desperate to befriend her colleagues' offspring and a misunderstanding puts Ryan under Stanley's thumb."
The Office,2,19,Michael's Birthday,7800000,3/30/06,8.1,4432,"In celebration of his birthday, Michael makes a mandatory invite of the staff during the workday to go ice skating."
The Office,2,20,Drug Testing,7800000,4/27/06,8.4,4522,Dwight plays the role of Volunteer Sheriff after finding half a joint in the Dunder Mifflin parking lot leading to an investigation. Pam gives Jim a play challenge which he tries to complete.
The Office,2,21,Conflict Resolution,7400000,5/4/06,8.7,4627,"When Michael takes over conflict resolution duties from HR, chaos ensues at Dunder Mifflin."
The Office,2,22,Casino Night,7600000,5/11/06,9.4,6692,The Dunder Mifflin crew holds a casino party at the warehouse and Michael has two dates.
The Office,3,1,Gay Witch Hunt,9110000,9/21/06,9,5952,"Michael apologizes to Oscar, after he finds out he's gay, for calling him a homosexual slur--but his apology outs Oscar to the entire office. And Jim decides to take a promotion at the Stamford office."
The Office,3,2,The Convention,7780000,9/28/06,8.2,4354,"Michael and Dwight go to a convention in Philadelphia and run into Jim, and Michael becomes jealous of Jim's relationship with his new boss. Meanwhile, Pam gets ready for her first date since her engagement."
The Office,3,3,The Coup,8890000,10/5/06,8.5,4562,"Michael is in trouble once again as Jan busts him for declaring it's ""Movie Monday"" where everyone watches a movie and neglects work. Angela pushes Dwight to make a move on Michael's job while Pam and Jim find creative ways to waste time."
The Office,3,4,Grief Counseling,8830000,10/12/06,8,4366,Michael takes on the role of office grief counselor when he learns that his old boss has died.
The Office,3,5,Initiation,8460000,10/19/06,8.1,4248,Dwight takes former temp Ryan to his beet farm to initiate Ryan to his new job at Dunder Mifflin.
The Office,3,6,Diwali,8810000,11/2/06,7.9,4443,"Michael encourages the entire Scranton branch to support Kelly and attend a local celebration of Diwali, the Hindu Festival of Lights. Meanwhile, Andy convinces Jim to turn a late night of work into a drinking game."
The Office,3,7,Branch Closing,8050000,11/9/06,8.6,4371,"When Jan tells Michael that the Scranton Branch will be shutting down, Michael strives to keep his staff's spirits up. Meanwhile, everyone privately begins to envision how their lives will change in the aftermath."
The Office,3,8,The Merger,8630000,11/16/06,8.7,4558,Jan informs Michael that the Scanton branch of Dunder Mifflin will be merging with the Stamford Branch. Jim and Pam are reunited while the other employees of both branches must adjust to their new co-workers.
The Office,3,9,The Convict,9070000,11/30/06,8.3,4564,"Michael learns that one of the new employees at Dunder Mifflin Scranton has a criminal record. Meanwhile, Jim helps Andy make a move on Pam."
The Office,3,10,A Benihana Christmas,8440000,12/14/06,8.8,4791,"Trouble among the members of the party planning committee results with Pam and Karen hosting a rival Christmas party, but Michael isn't interested in celebrating after being dumped by Carol."
The Office,3,11,Back from Vacation,8800000,1/4/07,8.6,4333,"Michael isn't supposed to let anyone know that he and Jan went on vacation together in Jamaica, but he accidentally circulates a compromising photo of them to the office via e-mail."
The Office,3,12,Traveling Salesmen,10120000,1/11/07,8.6,4371,"Dwight does a favor for Angela to keep her from getting in trouble. Andy finds out and uses it against him to get in tighter with Michael. Now Dwight must fess up, which will reveal his relationship with Angela, or risk getting fired."
The Office,3,13,The Return,10200000,1/18/07,8.8,4592,"Andy does the impossible--he makes everyone in the office miss Dwight, who is forced to take a job at Staples. Meanwhile, Oscar comes back to the office and Michael predictably throws a stereotypical Mexican party to celebrate."
The Office,3,14,Ben Franklin,10110000,2/1/07,8,4246,"Michael asks Jim to get a male stripper for Phyllis's office bachelorette party, but he gets a Ben Franklin impersonator instead. Meanwhile, the men's bachelor party goes as planned until Michael becomes uncomfortable with the stripper."
The Office,3,15,Phyllis' Wedding,8840000,2/8/07,8.2,4301,"Michael exaggerates the importance of his small role in Phyllis's wedding and makes an ass out of himself, and Pam notices that Phyllis stole all of her wedding ideas from her original wedding plans."
The Office,3,16,Business School,8840000,2/15/07,8.9,4994,"Michael is a guest speaker for Ryan's business class, but they have a falling-out after Michael finds out that Ryan spoke negatively about Dunder-Mifflin. And back at the office, Dwight tries to kill a bat that he found in the ceiling."
The Office,3,17,Cocktails,8300000,2/22/07,8.5,4251,"While Michael and Jan go to their first Dunder Mifflin outing as an official couple, the office workers left behind go out for happy hour. During happy hour, Roy finds out that Jim and Pam kissed at Casino Night."
The Office,3,18,The Negotiation,6740000,4/5/07,9,4848,"Dwight saves Jim from an attack by Roy, but Dwight won't allow Jim to thank him for it. Meanwhile, Darryl asks Michael for a pay raise, and Michael discovers that he is woefully underpaid--so Michael goes to headquarters to ask for one himself."
The Office,3,19,Safety Training,7710000,4/12/07,8.8,4516,"Andy returns to the office after weeks of anger management training, determined to make a fresh start with all the Dunder-Mifflin employees. Meanwhile, it's safety training day in the office, and Michael and Dwight are on a mission to illuminate the dangers of the workplace."
The Office,3,20,Product Recall,7560000,4/26/07,8.7,4455,"Michael tries to be proactive during a watermark crisis, but only makes the situation worse. Meanwhile, Angela has trouble being apologetic with customers, and Andy discovers a secret about his new girlfriend."
The Office,3,21,Women's Appreciation,7000000,5/3/07,8.8,4519,"Phyllis gets flashed in the parking lot, and Dwight goes all out to secure the premises. Michael ostensibly takes the women in the office to the mall to comfort them, but he's really doing it to get advice about breaking up with Jan."
The Office,3,22,Beach Games,7200000,5/10/07,9.2,5211,"Michael uses ""beach day"" at Dunder-Mifflin to find out which employee would be his most capable replacement, just in case he receives the promotion to the New York office that he's applied for."
The Office,3,23,The Job,7880000,5/17/07,9.3,5482,"Michael appoints Dwight as regional manager, anticipating that he will receive the job at corporate. Jim and Karen also interview for the same position. And Michael gets back together with Jan after she gets a boob job."
The Office,4,1,Fun Run,9700000,9/27/07,8.8,5065,"Michael accidentally runs over Meridith in the parking lot, and his guilt causes him to organize a 5-K run for her. Dwight and Angela have a falling-out after he kills her cat, and Jim and Pam's relationship is discovered."
The Office,4,2,Dunder Mifflin Infinity,8490000,10/4/07,8.3,4174,"Michael feels threatened when Ryan returns to the Scranton office to share his ideas about the future of Dunder Mifflin. Jim and Pam's relationship is shared with the entire office, while Angela and Dwight's relationship is on the rocks."
The Office,4,3,Launch Party,8910000,10/11/07,8.4,4064,"The Dunder Mifflin Infinity website is launching and Michael is excited about going to the big launch party in New York while Angela plans a satellite party for the Scranton branch. Meanwhile, Dwight competes against the website to see who can sell the most paper in one day."
The Office,4,4,Money,8500000,10/18/07,8.7,4377,"As Jan renovates the condo, Michael confronts his growing debt every way he can, which includes pressuring his employees for a loan. Pam and Jim spend a night out on Dwight's family beet farm, now a bed and breakfast."
The Office,4,5,Local Ad,8980000,10/25/07,8.8,4488,"Michael tries to make a local Dunder Mifflin commercial that is better than the one the professional ad agency made for them. Meanwhile, Andy tries to confide in Dwight about his new relationship with Angela."
The Office,4,6,Branch Wars,8390000,11/1/07,8.5,4150,"Michael and Dwight try to play a prank on Karen, who is now manager of the Utica branch, after she tries to steal Stanley from the Scranton office. Meanwhile, Pam, Toby, and Oscar start their own exclusive office book club."
The Office,4,7,Survivor Man,8290000,11/8/07,8.2,3984,"After Michael isn't invited to a camping trip with Ryan, he sets out to prove that he can brave it out in the wilderness by himself. Jim, who is in charge of the office while Michael is gone, tries to change the birthday party policy."
The Office,4,8,The Deposition,8860000,11/15/07,8.7,4235,"Michael is put in an awkward position when Jan sues Dunder Mifflin for wrongful termination and he is deposed as a witness. Meanwhile, Kelly begins smack-talking Pam after Darryl beats Jim at Ping-Pong."
The Office,4,9,Dinner Party,9220000,4/10/08,9.5,8203,"Michael invites Jim and Pam and Andy and Angela to a couples-only dinner party, which makes Dwight very jealous. However, the only thing he's missing is a ringside seat to witness Michael and Jan's extremely dysfunctional home life."
The Office,4,10,Chair Model,9810000,4/17/08,8,3922,"Kevin and Andy team up to reclaim the stolen Dunder Mifflin parking spaces, which forces them into a showdown with the other four bosses of the office park. Meanwhile, Michael becomes fascinated by a woman modeling chairs in a catalog."
The Office,4,11,Night Out,7560000,4/24/08,8.6,4076,"Michael and Dwight go to New York to party with Ryan, who is having lots of personal and professional problems. The rest of the office employees work late, and wind up getting locked in the business park."
The Office,4,12,Did I Stutter?,7670000,5/1/08,8.3,3910,"Michael tries to figure out how to respond to Stanley's insubordination during a meeting, and Dwight buys Andy's vehicle and immediately flips it for more money."
The Office,4,13,Job Fair,7220000,5/8/08,7.7,3744,"Dunder Mifflin participates in a high school job fair, but few students are interested. Jim, Andy, and Kevin play a round of golf with a prospective client. Back at the office, everyone but Dwight and Angela leave for the day."
The Office,4,14,"Goodbye, Toby",8070000,5/15/08,9.4,5577,"Michael throws an extravagant going-away party for Toby, and falls in love with the woman who is replacing him. Jim plans to propose to Pam at the party, but gets out-staged. Back at corporate, Ryan is arrested for fraud."
The Office,5,1,Weight Loss,9200000,9/25/08,8.8,4597,"Michael tries to motivate the Scranton branch to lose weight as part of an interoffice competition. Jim is lost after Pam leaves for art school in New York, and Angela continues to see Dwight even though she is now engaged to Andy."
The Office,5,2,Business Ethics,8990000,10/9/08,8.2,3770,A confession at an H.R. business ethics seminar leads to a dispute between Michael and Holly over whether Meredith should be fired. Dwight tries to prove to Jim how long he can go without taking a personal break.
The Office,5,3,Baby Shower,8070000,10/16/08,8,3759,"After planning an office baby shower for Jan, Michael is upset when he finds out that she had the baby without him--even though he's already been told that he's not the baby's father."
The Office,5,4,Crime Aid,7740000,10/23/08,8.1,3617,"Michael and Holly have sex for the first time, and Michael holds a fundraiser for the office after it is burglarized. Dwight confides in Phyllis after Andy and Angela set a wedding date, and Jim runs into Pam's ex-fiancé, Roy."
The Office,5,5,Employee Transfer,9320000,10/30/08,8,3718,Holly is transferred back to New Hampshire after corporate discovers that she and Michael are dating. Dwight tries to apply to Cornell to get under Andy's skin. Jim's brothers and Pam decide to play a trick on Jim when they meet for lunch.
The Office,5,6,Customer Survey,8350000,11/6/08,8.5,3879,"Dwight and Jim believe that something is suspicious about their low customer performance ratings. After consulting with Angela, Andy finds the perfect site for their wedding--Dwight's beet farm."
The Office,5,7,Business Trip,8180000,11/13/08,8.2,3619,"David Wallace sends Michael on a business trip to Winnipeg to help him forget about Holly's transfer to Nashua, and Pam tells Jim that she failed a class and has to stay in New York City."
The Office,5,8,Frame Toby,8400000,11/20/08,8.6,4038,"When Michael discovers that corporate has brought back Toby to replace Holly, he tries to frame him with drugs and to get him fired. Meanwhile, Pam has issues with the disgusting microwave. Finally, Jim surprises Pam by buying his parents' house."
The Office,5,9,The Surplus,8330000,12/4/08,8.8,4009,"Michael has to spend the office surplus by they end of the day, but he can't decide between a copier or new chairs. Dwight plays a dirty trick on Angela as they prepare for Andy and Angela's wedding on the beet farm."
The Office,5,10,Moroccan Christmas,8790000,12/11/08,8.4,3751,"Phyllis blackmails Angela into doing the work for the Christmas party, which Michael turns into an intervention after Meredith gets drunk and sets her hair on fire. Meanwhile, Dwight corners the market on a popular Christmas gift."
The Office,5,11,The Duel,8500000,1/15/09,8.7,3913,"Moments before he leaves for New York for a meeting with David Wallace, Michael tells Andy that Angela and Dwight are seeing each other. Andy and Dwight then decide to have it out in the parking lot."
The Office,5,12,Prince Family Paper,8740000,1/22/09,8,3766,"Michael's conscience gets the best of him after he and Dwight go undercover to scout a family-run competitor. Back at the office, everyone else spends the day debating whether Hilary Swank is hot."
The Office,5,13,Stress Relief,22910000,2/1/09,9.7,11895,"Dwight's too-realistic fire alarm gives Stanley a heart attack. When he returns, Michael learns that he is the cause of Stanley's stress. To remedy the situation, he forces the office to throw a roast for him."
The Office,5,14,Lecture Circuit: Part 1,8390000,2/5/09,8.2,3594,"While on lecture tour to other Dunder Mifflin branches, Michael and Pam discover that Jim's ex-girlfriend Karen is pregnant. At the office, Andy falls for a prospective client, and Jim and Dwight try to set up Kelly's birthday party."
The Office,5,15,Lecture Circuit: Part 2,8890000,2/12/09,8.1,3552,"Michael and Pam go to Nashua and discover that Holly has a new boyfriend. At the office, Jim and Dwight try to come up with a theme for Kelly's birthday party, and Angela gets a new cat."
The Office,5,16,Blood Drive,8630000,3/5/09,8,3557,"Michael holds a lonely hearts party on Valentine's Day at the office, hoping that he will run into a woman he met earlier that day at a blood drive. Meanwhile, Jim and Pam have an awkward lunch with Phillis and Bob Vance."
The Office,5,17,Golden Ticket,7510000,3/12/09,8.7,3870,"Michael asks Dwight to be the scapegoat for one of his business ideas that backfired badly on him. But when that idea has an unexpected positive upside, Dwight still takes credit and Michael becomes furious."
The Office,5,18,New Boss,7950000,3/19/09,8.3,3617,"Michael gets upset when he gets a new boss to act as a buffer between him and David Wallace, and he gets even more upset when he disbands the Party Planning Committee and cancels Michael's fifteenth anniversary party."
The Office,5,19,Two Weeks,8450000,3/26/09,8.4,3602,"As Michael prepares to leave Dunder Mifflin, he announces that he will form his own paper company. Will anybody join him?"
The Office,5,20,Dream Team,7200000,4/9/09,8.3,3592,Michael and Pam begin their first day as the Michael Scott Paper Company putting together the rest of the staff and trying to raise money.
The Office,5,21,Michael Scott Paper Company,7940000,4/9/09,8.7,3946,"Tension and disillusionment begin to emerge as Michael, Pam, and Ryan move the Michael Scott Paper Company into a cramped ""workspace"" at the business park."
The Office,5,22,Heavy Competition,8240000,4/16/09,8.7,3708,"Dwight chooses loyalty to Dunder Mifflin over loyalty to Michael, which leads to a bitter battle between Michael and Dwight over Dwight's accounts. Back at Dunder Mifflin, Jim pretends to confide in Andy."
The Office,5,23,Broke,7210000,4/23/09,9.3,4998,"The Michael Scott Paper Company is gaining clients by offering lower prices than Dunder Mifflin, but is going broke in the process. However, Dunder Mifflin is losing clients to Michael, and is desperate to buy him out."
The Office,5,24,Casual Friday,7310000,4/30/09,8.3,3556,"Michael returns to Dunder Mifflin and brings Ryan and Pam in as salespeople, but the existing salespeople demand that Michael return the clients they stole back to them. Meanwhile, some employees take the idea of Casual Friday too far."
The Office,5,25,Cafe Disco,7710000,5/7/09,8.8,4172,"Michael tries to create a place to escape from work in the storage room that used to house the Michael Scott Paper Company, while Jim and Pam consider taking off and getting married that day."
The Office,5,26,Company Picnic,6720000,5/14/09,9,4255,"Michael runs into Holly at the company picnic, and the two of them accidentally reveal that the Buffalo branch is closing during a comedy skit before corporate has made the announcement."
The Office,6,1,Gossip,8200000,9/17/09,8.8,4184,"Michael regrets revealing that Stanley is having an affair, so he spreads a bunch of lies about everyone else to cover his tracks--except that one of the lies that he spread actually turns out to be true."
The Office,6,2,The Meeting,7330000,9/24/09,8.1,3402,"Michael sabotages--then promotes--Jim's efforts at getting a promotion, while Dwight and Toby try to prove that Darryl has submitted a fraudulent medical claim."
The Office,6,3,The Promotion,7280000,10/1/09,8,3390,Jim discovers just how hard being the boss can be when David Wallace forces Michael and him to determine which employees will be getting a raise.
The Office,6,4,Niagara: Part 1,9420000,10/8/09,9.4,6277,"The Office travels to Niagara Falls to celebrate Jim and Pam's wedding under strict orders not to mention Pam's pregnancy. Michael, Dwight, and Andy all want to hook up with guests at the wedding and Michael and Dwight meet twins."
The Office,6,5,Niagara: Part 2,9420000,10/8/09,9.5,5122,"Pam is forced to deal with an embarrassing injury for Andy the night before her wedding, while Kevin deals with the loss of his dress shoes on the morning of the ceremony."
The Office,6,6,Mafia,8100000,10/15/09,7.6,3582,Michael meets with an insurance salesman that visits the office and is later convinced by Dwight and Andy that he is part of the mafia.
The Office,6,7,The Lover,8520000,10/22/09,8.6,3766,"Jim and Pam return from their honeymoon and learn, to their horror, that Michael is dating Pam's mom. Meanwhile, Dwight gives Jim a ""gift""--which actually has a listening device attached to it."
The Office,6,8,Koi Pond,8200000,10/29/09,8.1,3410,"Michael is upset when he becomes the butt of all the office jokes after he falls in a koi pond. Andy and Pam go out together on some cold calls, and everybody mistakes them as a married couple."
The Office,6,9,Double Date,7940000,11/5/09,8.1,3369,"Michael sparks more anger from Pam when he breaks up with her mom on her birthday after he finds out she's 58, and Dwight unsuccessfully tries to get everyone in the office to owe him a favor."
The Office,6,10,Murder,7760000,11/12/09,8.7,4090,"The entire office is preoccupied about rumors of Dunder Mifflin's bankruptcy. Michael tries to create a distraction by engaging everyone in murder-mystery game, but Jim wonders if that is a good idea."
The Office,6,11,Shareholder Meeting,7430000,11/19/09,8.2,3403,"Michael speaks out of line at the Dunder Mifflin shareholders meeting and creates a big problem for management, while Jim discovers that nobody in the office thinks he's the ""real"" boss."
The Office,6,12,Scott's Tots,8100000,12/3/09,8.3,3918,"Ten years ago, Michael promised a group of third graders he would pay for their college tuition if they graduated. Now comes time to pay, and he can't do it. At the office, Dwight's employee of the month idea gets Jim in big trouble."
The Office,6,13,Secret Santa,8510000,12/10/09,8.5,3587,"Michael gets upset when Jim promises Phyllis that she can be the office Santa, but the office Christmas party may be overshadowed by some bad news from David Wallace."
The Office,6,14,The Banker,7290000,1/21/10,6.8,4380,A banker representing a potential buyer comes to the Scranton branch to interview the H.R. department before the sale goes through.
The Office,6,15,Sabre,7360000,2/4/10,7.6,3267,"Michael hates the changes that Dunder Mifflin's new owner is implementing, so he turns to David Wallace for advice. Jim and Pam find the perfect day care center, but Jim's mistake threatens to ruin the interview."
The Office,6,16,Manager and Salesman,7400000,2/11/10,8,3226,"Sabre's CEO wants the Scranton branch to have one manager, and Michael voluntarily steps down and lets Jim become the boss when he finds out that salespeople make more money. However, he soon comes to regret the decision."
