show,season,episode,title,us_viewers,air_date,imdb_rating,total_votes,description
Friends,2,2,The One with the Breast Milk,29800000,9/28/95,8.2,4827,"Monica goes shopping with Julie and tries to keep it a secret from Rachel. Ross is grossed out by Carol's breast milk. At his day job, Joey competes with a fellow cologne spritzer."
Friends,2,3,The One Where Heckles Dies,30200000,10/5/95,8.3,4841,"Mr. Heckles dies and leaves all his possessions to Monica and Rachel, Chandler worries he will die alone just like him. Meanwhile, Rachel and Monica argue over a lamp, Phoebe and Ross argue over evolution."
Friends,2,4,The One with Phoebe's Husband,28100000,10/12/95,7.9,4689,"When the gang find out Phoebe married a gay Canadian ice dancer for a green card, more of their secrets are revealed. Meanwhile, Rachel gives Ross bad advice on his relationship with Julie."
Friends,2,5,The One with Five Steaks and an Eggplant,28300000,10/19/95,8.2,4697,"The gang are divided by income issues; Monica, Ross and Chandler make more money, while Rachel, Phoebe, and Joey don't. Chandler also uses a case of mistaken identity to his advantage."
Friends,2,6,The One with the Baby on the Bus,30200000,11/2/95,8.6,5035,"Joey and Chandler are left to babysit Ben when Monica takes Ross to the hospital. Meanwhile, Phoebe loses her singing gig at Central Perk to a professional singer."
Friends,2,7,The One Where Ross Finds Out,30500000,11/9/95,9,5740,"A drunken Rachel calls Ross and reveals her feelings for him on his answering machine. Meanwhile, Monica keeps busy by being Chandler's personal trainer and Phoebe constantly wonders why her current boyfriend won't sleep with her."
Friends,2,8,The One with the List,32900000,11/16/95,8.5,4734,"With help from Chandler and Joey, Ross makes a list of pros and cons to decide whether to be with Julie or Rachel. Meanwhile, Monica gets a job making dessert with a disgusting synthetic chocolate substitute."
Friends,2,9,The One with Phoebe's Dad,27800000,12/14/95,7.9,4529,"Phoebe tracks down her father, but isn't sure whether she should meet him."
Friends,2,10,The One with Russ,32200000,1/4/96,8,4752,Monica gets back together with 'Fun Bobby' and realizes why he is always so upbeat. Rachel starts dating a guy called Russ who bears an uncanny resemblance to Ross.
Friends,2,11,The One with the Lesbian Wedding,31600000,1/18/96,8.1,4648,Rachel's mom comes to visit with big news. Monica caters Carol and Susan's wedding. Phoebe becomes 'possessed' by the spirit of a recently deceased client.
Friends,2,12,The One After the Superbowl: Part 1,52900000,1/28/96,8.6,4891,Ross goes to visit Marcel whilst on a trip to California and discovers he is working in commercials. Joey receives a fan letter from an attractive but unstable woman. Phoebe is asked to sing for children at a library.
Friends,2,13,The One After the Superbowl: Part 2,52900000,1/28/96,8.7,5073,"Ross finds Marcel on the set of a new movie, where Chandler bumps into a former schoolmate. Meanwhile, Rachel and Monica compete for the affections of Jean-Claude Van Damme."
Friends,2,14,The One with the Prom Video,33600000,2/1/96,9.4,7366,The gang watches a home video from the night of Monica and Rachel's prom. Joey gives Chandler a hideous bracelet.
Friends,2,15,The One Where Ross and Rachel... You Know,32900000,2/8/96,8.9,5138,Monica becomes infatuated with a friend of her parents when she caters a party for him. Ross and Rachel go on their first date. Joey and Chandler refuse to move when they get a new TV and two armchairs.
Friends,2,16,The One Where Joey Moves Out,31100000,2/15/96,8.6,4553,Joey and Chandler's friendship is jeopardized when Joey decides to move out. Monica worries about her parents finding out about her relationship with Richard when they attend a party together. Rachel and Phoebe go to get tattoos.
Friends,2,17,The One Where Eddie Moves In,30200000,2/22/96,8.3,4498,"Chandler gets a new roommate. Phoebe gets the chance to make a music video for her song ""Smelly Cat"". Ross and Monica clash when he is always at her and Rachel's apartment."
Friends,2,18,The One Where Dr. Ramoray Dies,30100000,3/21/96,8.4,4501,"Joey's soap opera character is killed off after he brags in an interview that he writes his own lines. Chandler is unnerved by Eddie's strange behavior, while Ross and Rachel compare their past lovers as do Richard and Monica."
Friends,2,19,The One Where Eddie Won't Go,31200000,3/28/96,8.5,4615,"Chandler demands that Eddie move out; however, he doesn't seem to get the message. Meanwhile, a book on empowerment for women inspires the girls. In order to pay his bills, Ross convinces Joey to audition for a role he doesn't want."
Friends,2,20,The One Where Old Yeller Dies,27400000,4/4/96,8.1,4372,Phoebe's world view is shattered when she learns how Old Yeller really ends. Monica becomes jealous when Richard starts hanging out with Chandler and Joey. Rachel panics when she learns that Ross has planned their whole life together.
Friends,2,21,The One with the Bullies,24700000,4/25/96,8.1,4415,Chandler and Ross run into two bullies at Central Perk. Monica tries her luck at the stock market to avoid taking a job at a 1950s themed diner. Phoebe drives upstate for a second time to meet her father while Joey and Rachel accompany her.
Friends,2,22,The One with the Two Parties,25500000,5/2/96,9,5487,"Chaos ensues when Rachel's recently divorced parents show up at her surprise birthday party, so the gang has to find ways to keep her parents separated otherwise they'll start fighting."
Friends,2,23,The One with the Chicken Pox,26100000,5/9/96,8,4432,Phoebe catches chicken pox just as an old flame arrives in town on leave from the Navy. Joey gets a job at Chandler's office. Monica is upset that Richard doesn't have any quirks.
Friends,2,24,The One with Barry and Mindy's Wedding,29000000,5/16/96,8.2,4433,Rachel reluctantly agrees to be maid of honor at her ex-fiancé Barry's wedding. Monica ponders her future with Richard. Joey has to practice kissing guys to get a role in Warren Beatty's new movie but Ross and Chandler are unwilling to help him.
Friends,3,1,The One with the Princess Leia Fantasy,26760000,9/19/96,8.4,4591,Monica suffers from insomnia and depression following her breakup with Richard. Joey struggles to accept Chandler and Janice's relationship. Ross confides in Rachel about one of his fantasies.
Friends,3,2,The One Where No One's Ready,26730000,9/26/96,9,6141,"A stressed Ross desperately and insistently tries to get the rest of the gang ready for a black tie event at the museum, while Joey and Chandler clash over personal belongings and personal space."
Friends,3,3,The One with the Jam,25230000,10/3/96,8,4378,Monica tries to get over Richard by using her free time to make jam and considers artificial insemination through a sperm bank. Phoebe is stalked by a man who mistakes her for Ursula.
Friends,3,4,The One with the Metaphorical Tunnel,26100000,10/10/96,8,4217,Chandler tries to get over his fear of commitment. Phoebe poses as Joey's agent after she forgets to tell him about an audition. Ross panics after seeing Ben play with a Barbie doll and tries to convince him to play with more manly toys.
Friends,3,5,The One with Frank Jr.,23250000,10/17/96,8.1,4328,Phoebe has trouble bonding with her half-brother Frank when he comes to visit. Joey attempts to build an entertainment center. Ross is challenged to name the five celebrities he'd like to sleep with most.
Friends,3,6,The One with the Flashback,23270000,10/31/96,9.1,5646,"The gang remember the events three years ago, when several of them almost slept together."
Friends,3,7,The One with the Race Car Bed,27360000,11/7/96,8.3,4267,Monica buys a bed from Janice's soon to be ex husband. Ross and Rachel have dinner with Rachel's father. Joey leads an acting class.
Friends,3,8,The One with the Giant Poking Device,28690000,11/14/96,8.3,4291,Chandler is devastated after Joey tells him he saw Janice kissing her ex-husband. Monica accidentally bumps Ben's head into a post when she and Rachel babysit. Phoebe is paranoid if she goes to dentist someone she knows will die.
Friends,3,9,The One with the Football,29280000,11/21/96,9,5940,"Old sibling rivalry between Monica and Ross resurfaces and postpones Thanksgiving dinner when the gang decide to play a game of ""touch"" football."
Friends,3,10,The One Where Rachel Quits,25100000,12/12/96,8.1,4284,Ross accidentally breaks a little girl's leg and tries to help her sell boxes of cookies which recreates Monica's childhood fixation. Rachel quits her job at Central Perk and Joey's Christmas tree selling conflicts with Phoebe's principles.
Friends,3,11,The One Where Chandler Can't Remember Which Sister,29800000,1/9/97,8.6,4444,A drunken Chandler fools around with one of Joey's sisters - but he can't remember which one. Ross becomes skeptical when a guy at the diner gets Rachel an interview for a position at Bloomingdales.
Friends,3,12,The One with All the Jealousy,29610000,1/16/97,8.2,4218,"Ross becomes insanely jealous of Mark. Monica hooks up with a co-worker, who writes her a poem with a hidden meaning. One of Joey's numerous lies on his resume is exposed when he takes part in a Broadway production."
Friends,3,13,The One Where Monica and Richard Are Just Friends,28030000,1/30/97,8.2,4227,"Monica's willpower is tested when she bumps into Richard. Joey and Rachel exchange their favorite books. Phoebe dates an athletic guy who doesn't realize he has a ""wardrobe malfunction""."
Friends,3,14,The One with Phoebe's Ex-Partner,28910000,2/6/97,7.8,4221,"Phoebe is reunited with her former singing partner who thinks ""Smelly Cat"" has hit potential; Chandler dates a woman with a prosthetic leg."
Friends,3,15,The One Where Ross and Rachel Take a Break,27250000,2/13/97,8.5,4529,Ross seeks solace at a party after a bitter fight with Rachel and ends up in the arms of another woman; Phoebe's date needs an interpreter to communicate.
Friends,3,16,The One with the Morning After,28260000,2/20/97,9.1,5525,"Ross is guilt-ridden after sleeping with Chloe and desperately tries to stop Rachel from finding out and when she does, the rest of the gang listen to them argue and end up trapped in Monica's room for the rest of the night."
Friends,3,17,The One Without the Ski Trip,25840000,3/6/97,8.3,4168,"Monica, Chandler, Phoebe and Joey become stuck in the middle of Ross and Rachel's fight following their break-up."
Friends,3,18,The One with the Hypnosis Tape,28070000,3/13/97,8.4,4312,Monica goes out with a guy who turns out to be a software billionaire. Chandler's stop smoking hypnosis tape has an unexpected side effect. Phoebe's brother Frank makes a surprise announcement that he is getting married - to a woman twice his age.
Friends,3,19,The One with the Tiny T-Shirt,23650000,3/27/97,8.1,4147,"Rachel goes on her first date, after splitting from Ross, with Mark. Joey clashes with his co-star in his new play. Monica continues to date Pete, even though she is still not attracted to him."
Friends,3,20,The One with the Dollhouse,24360000,4/10/97,8.1,4114,"Monica's aunt dies and leaves her an antique dollhouse that she doesn't want Phoebe to play with; Rachel regrets setting up Chandler with her boss, Joanna."
Friends,3,21,The One with the Chick and the Duck,23220000,4/17/97,8.7,4442,"Joey buys a chick for him and Chandler, Pete offers Monica a job at his restaurant but she is undecided if she should accept it. Ross shows his continued feelings for Rachel when he gives up being on TV for her."
Friends,3,22,The One with the Screamer,22630000,4/24/97,8.2,4185,"Ross witnesses Rachel's date screaming at people. Meanwhile, Joey becomes upset when Kate is offered a job in Los Angeles; Phoebe refuses to hang up the phone when she is placed on hold by her phone company."
Friends,3,23,The One with Ross's Thing,24170000,5/1/97,8,4109,Ross seeks medical help when he finds a mysterious skin condition on his backside. Phoebe struggles to choose between two guys; Monica can't decide what to do about Pete when she thinks he is going to propose.
Friends,3,24,The One with the Ultimate Fighting Champion,23070000,5/8/97,8.1,4273,Monica struggles to support Pete in his goal to become the Ultimate Fighting Champion. Chandler is uneasy when his boss playfully slaps his butt. Rachel becomes jealous when Ross starts dating a woman that was introduced to him by Phoebe.
Friends,3,25,The One at the Beach,23390000,5/15/97,8.8,4759,"While at the beach, Phoebe meets a family friend with links to her past; Ross discovers that Rachel still loves him and must decide between her and Bonnie."
Friends,4,1,The One with the Jellyfish,29430000,9/25/97,9.1,5379,"Ross chooses between Rachel and his bald-headed girlfriend Bonnie; Joey, Chandler, and Monica have a perilous encounter with a jellyfish at the beach."
Friends,4,2,The One with the Cat,25540000,10/2/97,8,4197,Phoebe becomes convinced that the spirit of her dead mother is inside a cat. Chandler and Joey are robbed. Monica goes on a date with a guy from her high school.
Friends,4,3,The One with the 'Cuffs,23980000,10/9/97,8.5,4258,Monica tries to avoid criticism when she caters a party for her mother. Chandler ends up half naked and handcuffed to a chair in Rachel's boss's office. Joey tries to get educated from a salesman trying to sell him a set of encyclopedias.
Friends,4,4,The One with the Ballroom Dancing,24310000,10/16/97,8.2,4127,Joey is forced to help Treeger learn how to dance after he threatens to have Monica and Rachel evicted. Phoebe develops a crush on one of her clients. Ross tries to help Chandler quit the gym.
Friends,4,5,The One with Joey's New Girlfriend,24350000,10/30/97,8.4,4173,Chandler develops feelings for Joey's new girlfriend. Ross and Rachel try to make each other jealous with their dates. Phoebe's cold gives her a sexy singing voice.
Friends,4,6,The One with the Dirty Girl,25680000,11/6/97,8.5,4280,Ross's new girlfriend is nearly perfect until he discovers her apartment is very dirty. Chandler buys a better birthday present for Kathy than Joey. Phoebe helps Monica cater an event. Rachel is obsessed at finishing a crossword puzzle by herself.
Friends,4,7,The One Where Chandler Crosses the Line,26350000,11/13/97,8.7,4325,Chandler is guilt-ridden after kissing Kathy. Ross starts playing the keyboard again and everyone except Phoebe thinks he's terrible. Joey dates someone else while still attached to Kathy.
Friends,4,8,The One with Chandler in a Box,26760000,11/20/97,9.1,5408,Chandler tries to earn Joey's forgiveness by lying in a wooden box for six hours. Monica accidentally gets ice in her eye and her doctor turns out to be Richard's son and it's discovered Rachel exchanges the gifts she received in the past.
Friends,4,9,The One Where They're Going to Party!,23890000,12/11/97,7.9,4031,Monica ends up having to choose between a head chef position or the catering business she started with Phoebe. Rachel is close to getting a promotion but tragedy strikes. Chandler and Ross are excited when an old friend is coming to town.
Friends,4,10,The One with the Girl from Poughkeepsie,23220000,12/18/97,8,4005,"In order for her kitchen staff to acknowledge her authority, Monica hires Joey so she can fire him in front of them. Chandler unsuccessfully tries to set Rachel up with a co-worker. Ross can't choose between two girls."
Friends,4,11,The One with Phoebe's Uterus,23660000,1/8/98,8.5,4296,Newlyweds Frank and Alice ask Phoebe to be their surrogate. Joey gets a job as a tour guide at Ross's museum. Chandler asks Monica and Rachel for advice on how to sexually satisfy Kathy.
Friends,4,12,The One with the Embryos,27140000,1/15/98,9.5,7935,"Phoebe's uterus is examined for implantation of the embryos. Meanwhile, a seemingly harmless game between Chandler and Joey against Monica and Rachel escalates into a full blown contest where the stakes are raised higher and higher."
Friends,4,13,The One with Rachel's Crush,25270000,1/29/98,8.2,3990,"After seeing Kathy's play, Chandler becomes convinced she is cheating on him with her co-star. Rachel develops a crush on one of her customers. Monica becomes jealous when she realizes she is no longer the 'hostess'."
Friends,4,14,The One with Joey's Dirty Day,25080000,2/5/98,8.2,4030,"Joey arrives on the set of his latest movie unwashed, after a three-day fishing trip with his dad. Rachel sets up Ross with the niece of her boss. Chandler goes through three phrases to help recover from Kathy cheating on him."
Friends,4,15,The One with All the Rugby,24440000,2/26/98,8.5,4208,"Chandler runs into Janice, and finds her more irritating than ever. Meanwhile, Ross attempts to learn how to play rugby to impress Emily and Monica obsesses over a electric switch."
Friends,4,16,The One with the Fake Party,23130000,3/19/98,8.2,4058,Rachel organizes a fake good bye party for Emily so she can spend time with Joshua. A side effect from her pregnancy causes Phoebe to have a craving for meat.
Friends,4,17,The One with the Free Porn,23220000,3/26/98,8.6,4213,Chandler and Joey discover that they're getting a free porn channel on their TV. Monica encourages Ross to tell Emily he loves her just before she leaves for London. Phoebe gets a shock when she visits her OB-GYN.
Friends,4,18,The One with Rachel's New Dress,21720000,4/2/98,8.2,3983,Rachel has an awkward encounter with Joshua's parents. Phoebe is offered the chance to name one of the triplets. Ross becomes paranoid when Emily goes to London with Susan.
Friends,4,19,The One with All the Haste,21760000,4/9/98,8.7,4198,Ross proposes to Emily. Monica and Rachel try to win their apartment back from Chandler and Joey.
Friends,4,20,The One with All the Wedding Dresses,21940000,4/16/98,8.5,4124,"Monica tries on Emily's wedding dress, and can't stop wearing it. Jealous of Ross's proposal to Emily, Rachel tries to talk Joshua into marriage. Chandler takes Joey to a sleep clinic when he starts snoring."
Friends,4,21,The One with the Invitation,21510000,4/23/98,7.1,4446,"As Ross and Emily send out wedding invitations, he and Rachel each look back on their relationship together while Joey and Chandler look for a purpose in life."
Friends,4,22,The One with the Worst Best Man Ever,23150000,4/30/98,8.5,4033,"at first Ross chooses Joey to be his best man but after a mishap at his bachelor party, he decides he wants both Joey and Chandler as his best men. Phoebe's mood swings makes Monica and Rachel nervous."
Friends,4,23,The One with Ross's Wedding,31610000,5/7/98,8.7,4412,Phoebe tries to help Rachel deal with her feelings for Ross as the rest of the gang head to London for Ross and Emily's wedding.
Friends,4,24,The One with Ross's Wedding,31610000,5/7/98,9.2,5502,Phoebe tries to warn the gang that Rachel is coming to London to tell Ross she still loves him. Ross and Emily's parents get into an argument over the bill for the wedding. Monica and Chandler sleep together. The wedding ends with a gaffe.
Friends,5,1,The One After Ross Says Rachel,31120000,9/24/98,8.9,4704,"A humiliated Emily runs away after Ross says Rachel's name at the altar. Meanwhile, Chandler and Monica struggle to get time alone together."
Friends,5,2,The One with All the Kissing,25360000,10/1/98,9,4844,Chandler must constantly kiss the girls to cover up a kiss he gave to Monica to hide their affair. Phoebe gets irritated when the gang constantly talk about London. Rachel puts Monica in charge of her love life. Ross tries to contact Emily.
Friends,5,3,The One Hundredth,26820000,10/8/98,8.8,4408,"The gang take Phoebe to the hospital after she goes into labor. Monica threatens to go on a date with a male nurse after Chandler claims they are ""just goofing around."" Joey gets treated for kidney stones."
Friends,5,4,The One Where Phoebe Hates PBS,24090000,10/18/98,8.2,3955,Ross finally gets in touch with Emily and they try to work it out. Chandler gloats after Rachel reveals that Monica's secret boyfriend is the best sex she ever had. Phoebe and Joey debate if a selfless good deed exists.
Friends,5,5,The One with the Kips,25870000,10/29/98,8.7,4262,Chandler and Monica go away for the weekend but spend the entire time fighting. Ross tries to tell Rachel about his agreement with Emily.
Friends,5,6,The One with the Yeti,24990000,11/5/98,8,3948,The gang become frustrated with Emily's demands to Ross. Monica and Rachel mistake their new neighbor for a yeti. Phoebe receives a fur coat as a family heirloom from her mother.
Friends,5,7,The One Where Ross Moves In,24440000,11/12/98,8.3,4000,Ross moves in with Chandler and Joey after Emily's cousin kicks him out of his apartment. Phoebe dates a health inspector. Rachel plays hard-to-get with Danny.
Friends,5,8,The One with All the Thanksgivings,23920000,11/19/98,9.1,5523,The gang remember and share with each other their worst Thanksgivings.
Friends,5,9,The One with Ross's Sandwich,23030000,12/10/98,9.1,5103,Joey finds himself constantly covering for Chandler and Monica's affair. Ross becomes angry when someone at work eats his sandwich. Phoebe and Rachel enroll in a literature class.
Friends,5,10,The One with the Inappropriate Sister,23670000,12/17/98,8.1,3931,A bored Ross wreaks havoc in Chandler and Joey's lives. Rachel is uncomfortable with Danny's unusually close relationship with his sister. Phoebe runs into trouble whilst collecting donations for the poor during Christmas.
Friends,5,11,The One with All the Resolutions,27020000,1/7/99,9.1,4962,The gang make their New Years resolutions. Chandler struggles to not make jokes about everyone. Rachel uncovers a secret. Ross runs into trouble when he wears leather pants on a date.
Friends,5,12,The One with Chandler's Work Laugh,24820000,1/21/99,8.2,3922,Monica becomes annoyed at how Chandler sucks up to his boss by mimicking his boss's laugh and laughing at his tasteless jokes. Ross hooks up with Janice when he finds out Emily is getting married.
Friends,5,13,The One with Joey's Bag,24920000,2/4/99,8.1,3923,"Phoebe's grandmother dies, and Phoebe is shocked when her father turns up at the funeral. Meanwhile, Rachel gives Joey a ""man's bag"" for an audition, and Chandler is scared to tell Monica he doesn't like her massages."
Friends,5,14,The One Where Everybody Finds Out,27700000,2/11/99,9.7,10596,"When Phoebe finds out about Monica and Chandler, she and Rachel attempt to get them to confess their relationship."
Friends,5,15,The One with the Girl Who Hits Joey,29310000,2/18/99,8.5,4136,Ross makes enemies out of his new neighbors. Chandler freaks out about his relationship with Monica. Joey dates a girl who likes to playfully punch him but she doesn't realize she punches him too hard and Joey is reluctant to tell her.
Friends,5,16,The One with the Cop,26020000,2/25/99,8.6,4251,"Joey has a dream about Monica and becomes convinced he is in love with her. Meanwhile, Phoebe finds a police badge in Central Perk, and Ross tries to get his new sofa into his apartment."
Friends,5,17,The One with Rachel's Inadvertent Kiss,24480000,3/18/99,8.5,3948,Rachel has an awkward encounter when she interviews for a new job. Monica becomes jealous of Phoebe and Gary. Joey searches for a 'hot girl' in Ross's building.
Friends,5,18,The One Where Rachel Smokes,21880000,4/8/99,7.9,3833,"Rachel takes up smoking to feel more included at work. Joey auditions for a soup commercial with Ross's son Ben, but they end up competing against each other. Monica and Phoebe plan Rachel's surprise birthday party one month in advance."
Friends,5,19,The One Where Ross Can't Flirt,20850000,4/22/99,8.7,4261,"As Joey's grandmother visits to watch him on TV, Ross has trouble flirting with the pizza delivery girl, and Rachel tries to find an earring of Monica's that she has misplaced."
Friends,5,20,The One with the Ride Along,19630000,4/29/99,8.2,3832,The guys go on a ride-along with Gary. Rachel accidentally deletes a message from Emily on Ross's answering machine.
Friends,5,21,The One with the Ball,20920000,5/6/99,8.4,3978,"Gary asks Phoebe to move in with him but she's reluctant to and to overcome boredom, Ross and Joey start throwing a ball to each other. Rachel buys an expensive cat but it doesn't behave as she hoped it would."
Friends,5,22,The One with Joey's Big Break,21280000,5/11/99,8.2,3795,"Joey drives to Las Vegas to shoot to shoot a new movie where he is in the lead role. Rachel gets an eye infection but is reluctant to seek treatment because of her eye phobia. Phoebe is mad at Ross, but doesn't know why."
Friends,5,23,The One in Vegas: Part 1,25900000,5/20/99,8.8,4322,The gang go to Las Vegas to visit Joey. Chandler is angry when he finds out Monica had lunch with Richard. Ross and Rachel try to embarrass each other after an awkward encounter.
Friends,5,24,The One in Vegas: Part 2,25900000,5/20/99,9.1,4897,Chandler and Monica reconcile and hastily decide to get married. Ross and Rachel get drunk and roam the casino. Phoebe deals with a 'lurker' on the slot machines.
Friends,6,1,The One After Vegas,27740000,9/23/99,8.7,4221,Ross and Rachel deal with the aftermath of their drunken escapade. Phoebe and Joey take a road trip back to New York in Phoebe's grandmother's cab. Monica and Chandler ponder the idea of marriage.
Friends,6,2,The One Where Ross Hugs Rachel,22950000,9/30/99,8.2,3831,Monica and Chandler try to tell Rachel and Joey that they're moving in together. Phoebe thinks that Ross didn't get the annulment because he still loves Rachel.
Friends,6,3,The One with Ross's Denial,21600000,10/7/99,8.1,3778,Ross tries to deny he still has feelings for Rachel. Joey interviews for a new roommate. Monica and Chandler argue over what to do with the spare room when they move in together.
Friends,6,4,The One Where Joey Loses His Insurance,21070000,10/14/99,8.5,3949,"Joey's health benefits lapse just as he develops a hernia. Ross is given a professorship at NYU and eager to impress his students, he puts on a fake English accent."
